{
  "meta": {
    "skill_name": "rta-user-skill",
    "version": "0.1.0",
    "mode": "transcript_analysis",
    "created_at": "2026-06-29",
    "language": "zh-CN"
  },
  "business_context": {
    "client_name": "示例客户",
    "industry": "专业服务",
    "business_type": "个人 IP / 咨询服务",
    "main_offer": "咨询与陪跑",
    "target_service": "用户画像与内容策略前置分析",
    "current_customer_source": "朋友介绍与内容咨询",
    "analysis_scope": "用户画像与十阶段用户生命旅程"
  },
  "interview_source": {
    "source_type": "transcript",
    "raw_transcript_available": true,
    "summary": "客户希望通过个人表达与内容获得更稳定的咨询与成交。",
    "information_quality": "medium",
    "missing_information": [
      "最近 3 个真实成交案例细节",
      "高价值用户的长期合作路径"
    ]
  },
  "user_profiles": {
    "potential_users": [
      {
        "name": "方向模糊的起步者",
        "description": "已经想做内容，但还没有形成清晰服务路径的人。",
        "identity": "个人服务从业者",
        "current_situation": "有经验，但表达、定位和用户承接都不稳定。",
        "typical_needs": ["找到表达方向", "明确用户是谁", "知道先做什么"],
        "surface_problems": ["内容发不动", "不知道讲什么", "没有稳定咨询"],
        "deep_pains": ["怕自己讲错方向", "怕投入后没结果", "怕自己不适合做 IP"],
        "trigger_scenarios": ["看到同行出单", "准备转型", "线下获客变难"],
        "decision_barriers": ["不确定方法是否适合自己", "担心内容做了也没人买", "怕浪费时间"],
        "trust_sources": ["真实案例", "能听懂自己的表达方式", "阶段性方法清晰"],
        "payment_willingness": "低到中",
        "fit_reason": "适合作为前置验证对象，但需要先建立信心。",
        "identification_signals": ["常说不知道怎么开始", "对定位反复修改", "会频繁看别人案例"],
        "source_evidence": ["示例逐字稿片段：我知道要做内容，但我不知道怎么讲。"]
      }
    ],
    "core_users": [
      {
        "name": "已有业务基础的表达升级者",
        "description": "本身有专业能力，希望把表达变成稳定咨询入口的人。",
        "identity": "顾问 / 律师 / 教练 / 服务型个体",
        "current_situation": "有成交经验，但内容没有稳定承接到业务。",
        "typical_needs": ["做清楚用户画像", "形成内容表达框架", "让内容服务成交"],
        "surface_problems": ["内容和业务脱节", "表达不稳定", "用户来了一句就断"],
        "deep_pains": ["怕内容做成自嗨", "怕用户看了不信", "怕自己讲不出差异"],
        "trigger_scenarios": ["开始系统做 IP", "希望扩大来源", "原有转介绍变慢"],
        "decision_barriers": ["不确定自己适合什么表达方式", "担心陪跑泛泛而谈", "怕交付后落不了地"],
        "trust_sources": ["真实业务理解", "能把案例拆成方法", "能直接接到后续内容动作"],
        "payment_willingness": "中到高",
        "fit_reason": "最适合进入完整前期交付。",
        "identification_signals": ["已经有稳定业务", "会谈用户质量而不是只谈流量", "在意后续转化链路"],
        "source_evidence": ["示例逐字稿片段：不是没内容，是不知道哪些内容对业务有用。"]
      }
    ],
    "high_value_users": [
      {
        "name": "要搭建长期增长系统的决策者",
        "description": "希望把内容、用户运营和成交协同起来的人。",
        "identity": "高客单专业服务负责人",
        "current_situation": "已有业务验证，希望从个人表达升级到系统化增长。",
        "typical_needs": ["明确高价值用户路径", "形成可复制内容系统", "提升私域承接效率"],
        "surface_problems": ["内容产能不稳", "用户分层不清", "高价值成交靠个人经验"],
        "deep_pains": ["怕增长不可复制", "怕团队接不住", "怕自己离开就失效"],
        "trigger_scenarios": ["开始搭团队", "想做长期 IP", "想提升高客单比例"],
        "decision_barriers": ["担心项目太轻", "担心缺少真实业务理解", "担心结果只停留在内容层"],
        "trust_sources": ["真实成交案例", "对用户和商业都有理解", "能形成后续动作图"],
        "payment_willingness": "高",
        "fit_reason": "适合后续延伸到内容、转化和运营系统。",
        "identification_signals": ["会问长期打法", "会关心团队协同", "会关心高价值用户怎么来"],
        "source_evidence": ["示例逐字稿片段：我想做的不只是内容，而是一个能长期跑的系统。"]
      }
    ],
    "unfit_users": [
      {
        "name": "只想快速拿流量的人",
        "description": "更在意速成流量，不愿意做用户理解和表达打磨的人。",
        "identity": "短期投机型客户",
        "current_situation": "想马上出爆款或马上成交。",
        "typical_needs": ["快速涨粉", "立刻出单"],
        "surface_problems": ["内容焦虑", "过度比较同行"],
        "deep_pains": ["没有耐心搭系统", "不能接受验证周期", "只想要现成答案"],
        "trigger_scenarios": ["看见别人爆了", "短期业绩压力"],
        "decision_barriers": ["不接受访谈", "不愿意提供材料", "不愿意做配合"],
        "trust_sources": ["立刻可见的外部结果"],
        "payment_willingness": "不稳定",
        "fit_reason": "与当前交付方式不匹配。",
        "identification_signals": ["只问多久能爆", "只问能不能代做", "不愿意深聊用户"],
        "source_evidence": ["示例逐字稿片段：有没有一种方法，我照着发就行。"]
      }
    ]
  },
  "user_lifecycle": [
    {
      "stage": "无意识",
      "stage_goal": "让用户先意识到自己并不是缺内容，而是缺清晰表达与用户理解。",
      "typical_scenarios": ["业务还靠熟人介绍", "偶尔发内容但没有反馈", "把没结果归因于平台"],
      "touchpoints": ["朋友圈", "短视频刷到同类表达", "同行讨论"],
      "user_thoughts": ["可能不是平台的问题？", "是不是我讲得不对？"],
      "user_behaviors": ["继续零散发内容", "观察同行", "暂时不行动"],
      "core_pains": ["不知道问题出在哪", "没有系统判断标准", "对内容与业务关系模糊"],
      "trust_barriers": ["还不觉得需要外部帮助", "不确定专业分析是否必要"],
      "progress_actions": ["用一句话点出误区", "用典型场景击中他", "用反常识建立停留"],
      "signals": ["开始承认自己有表达问题", "会停下来听完整个观点", "开始对号入座"]
    },
    {
      "stage": "有意识",
      "stage_goal": "让用户知道自己需要用户理解与表达梳理。",
      "typical_scenarios": ["内容持续无反馈", "客户咨询质量差", "表达越做越乱"],
      "touchpoints": ["短视频", "案例拆解", "朋友转发"],
      "user_thoughts": ["我可能需要有人帮我理一下", "原来问题不只是拍摄"],
      "user_behaviors": ["收藏内容", "发给朋友", "开始比较方案"],
      "core_pains": ["不知道从哪里开始改", "不懂什么是有效用户画像", "担心自己判断失真"],
      "trust_barriers": ["怕遇到空话型顾问", "怕没有行业理解"],
      "progress_actions": ["用案例说明前后差异", "明确交付边界", "展示分析框架"],
      "signals": ["开始询问具体怎么做", "开始问适不适合自己", "愿意继续看案例"]
    },
    {
      "stage": "记住你",
      "stage_goal": "让用户记住你的判断方式和表达风格。",
      "typical_scenarios": ["反复刷到同类内容", "在某个观点上被点中", "看到真实案例"],
      "touchpoints": ["固定栏目", "高辨识度表达", "朋友圈持续输出"],
      "user_thoughts": ["这个人讲得挺像我现在的问题", "他的判断有点准"],
      "user_behaviors": ["记住名字", "留意下一条内容", "向身边人提起"],
      "core_pains": ["信息太多记不住谁", "很多表达都很像", "难区分谁是真的懂业务"],
      "trust_barriers": ["还没有形成稳定信任", "只停留在印象层"],
      "progress_actions": ["保持固定主题", "重复核心判断", "输出可复述观点"],
      "signals": ["会复述你的观点", "能记住你的标签", "再次遇到时有熟悉感"]
    },
    {
      "stage": "关注你",
      "stage_goal": "让用户愿意持续追踪你的表达。",
      "typical_scenarios": ["内容持续打中痛点", "开始对你的方法产生兴趣", "想看看后续还有什么"],
      "touchpoints": ["关注账号", "加好友", "订阅合集"],
      "user_thoughts": ["我再看看他后面怎么讲", "也许能从这里找到方向"],
      "user_behaviors": ["关注", "翻看过往内容", "收藏系列内容"],
      "core_pains": ["关注后仍然看不出体系", "内容碎片化难吸收", "不知道哪些最关键"],
      "trust_barriers": ["怕前面讲得好、后面空", "担心只是营销包装"],
      "progress_actions": ["做系列化表达", "把观点分层", "给出内容地图"],
      "signals": ["关注后连续看多条", "会翻历史内容", "会发来某条内容提问"]
    },
    {
      "stage": "了解你",
      "stage_goal": "让用户理解你是做什么的、怎么做、适合谁。",
      "typical_scenarios": ["准备咨询前做功课", "想判断是否匹配", "想知道交付到底是什么"],
      "touchpoints": ["合作方案", "案例页", "置顶内容"],
      "user_thoughts": ["他到底交付什么", "是不是适合我现在的阶段"],
      "user_behaviors": ["认真看介绍", "比对服务", "记下疑问"],
      "core_pains": ["怕交付模糊", "怕自己阶段不对", "怕买完还是不知道怎么做"],
      "trust_barriers": ["看不到具体交付", "不知道和普通代运营有什么差异"],
      "progress_actions": ["讲清服务边界", "展示交付清单", "区分适合与不适合用户"],
      "signals": ["开始问服务细节", "开始问自己适不适合", "会对比不同合作路径"]
    },
    {
      "stage": "接触你",
      "stage_goal": "促成第一次有效沟通。",
      "typical_scenarios": ["私信咨询", "加微信后交流", "预约访谈"],
      "touchpoints": ["私信", "微信", "表单"],
      "user_thoughts": ["我先聊聊看", "看看对方是不是真的懂我"],
      "user_behaviors": ["提出具体问题", "描述现状", "试探性交互"],
      "core_pains": ["不知道该怎么描述自己", "怕被标准化推销", "怕聊了也没结果"],
      "trust_barriers": ["第一次接触缺少安全感", "担心对方不懂自己的行业"],
      "progress_actions": ["先判断阶段", "先听业务现状", "先给结构化反馈"],
      "signals": ["愿意说具体问题", "愿意提供背景材料", "愿意进入下一步访谈"]
    },
    {
      "stage": "好朋友",
      "stage_goal": "让用户感受到被理解，形成高信任预期。",
      "typical_scenarios": ["访谈过程顺畅", "被准确复述问题", "感受到表达风格被理解"],
      "touchpoints": ["深度访谈", "阶段性反馈", "语音沟通"],
      "user_thoughts": ["他确实懂我现在卡在哪", "这个人不是在套模板"],
      "user_behaviors": ["更愿意展开说", "主动补材料", "开始讨论合作可能"],
      "core_pains": ["怕被误解", "怕问题被说浅了", "怕自己真实诉求讲不明白"],
      "trust_barriers": ["需要更强的专业确认", "需要知道后面怎么落地"],
      "progress_actions": ["准确复述问题", "把混乱信息结构化", "明确后续交付路线"],
      "signals": ["主动补充细节", "会说你说得很准", "开始讨论下一步合作"]
    },
    {
      "stage": "选择你",
      "stage_goal": "完成合作决策。",
      "typical_scenarios": ["对比其他方案", "内部衡量预算", "确认合作边界"],
      "touchpoints": ["合作方案", "报价沟通", "最终答疑"],
      "user_thoughts": ["值不值得做", "先从哪一步开始更合适"],
      "user_behaviors": ["确认价格", "确认节奏", "确认交付形式"],
      "core_pains": ["预算焦虑", "怕第一步选错", "怕投入后不好执行"],
      "trust_barriers": ["还需要最后的确定性", "需要明确升级逻辑"],
      "progress_actions": ["给出匹配路径", "明确阶段目标", "降低第一次决策复杂度"],
      "signals": ["开始问具体付款和排期", "开始问不同方案差异", "开始确认执行方式"]
    },
    {
      "stage": "有收获",
      "stage_goal": "让用户感受到结果与方法价值。",
      "typical_scenarios": ["拿到交付", "开始使用交付内容", "看到表达更清晰"],
      "touchpoints": ["交付文件", "复盘沟通", "后续使用反馈"],
      "user_thoughts": ["终于知道用户是谁了", "原来之前卡在这里"],
      "user_behaviors": ["开始按交付执行", "反馈使用感受", "提出下一步需求"],
      "core_pains": ["怕拿到后不会用", "怕只是一份文件", "怕没有后续衔接"],
      "trust_barriers": ["需要看到真实可用性", "需要确认能接后续动作"],
      "progress_actions": ["讲清怎么用", "连接后续内容动作", "沉淀可复用框架"],
      "signals": ["开始直接引用交付内容", "主动反馈有帮助", "开始追问下一步怎么接"]
    },
    {
      "stage": "转介绍",
      "stage_goal": "让满意用户愿意主动推荐。",
      "typical_scenarios": ["朋友问起", "同行交流", "客户自己得到结果"],
      "touchpoints": ["口碑传播", "私域转发", "线下介绍"],
      "user_thoughts": ["这个方法可能也适合别人", "我愿意把他推荐出去"],
      "user_behaviors": ["转发内容", "口头推荐", "带来新咨询"],
      "core_pains": ["怕推荐后别人体验不好", "怕自己说不清价值", "怕结果不稳定"],
      "trust_barriers": ["需要持续稳定的交付口碑", "需要有可复述的价值表达"],
      "progress_actions": ["沉淀推荐话术", "沉淀典型成果", "维持关系和反馈闭环"],
      "signals": ["主动提到别人可能需要", "开始介绍朋友来聊", "愿意公开认可你的方法"]
    }
  ],
  "follow_up_questions": [
    "最近 3 个真实成交客户分别是怎么来的？",
    "高价值用户最终为什么会愿意长期合作？",
    "用户在哪个阶段最容易流失？"
  ],
  "source_evidence": [
    "示例逐字稿片段：不是没内容，是不知道哪些内容对业务有用。",
    "示例逐字稿片段：我想做的不只是内容，而是一个能长期跑的系统。"
  ],
  "confidence_notes": [
    "当前样例以演示结构为主，不代表真实客户结论。",
    "如进入真实交付，应以访谈逐字稿和真实案例替换占位内容。"
  ]
}

